{
  "schemaVersion": 1,
  "promotionId": "m8.9-forward-fix-linux-0.9.1",
  "validatedGitCommit": "c5e1b28c916a5534d84abed2257a0b513509cbae",
  "generatorVersion": "1.1.0",
  "inputs": {
    "validationSummary": {
      "size": 2824,
      "sha256": "736a7f4adc488366e3f300f68d9ce56464481b037d7eff52684430fe739e5e32"
    },
    "gitBundle": {
      "size": 725600,
      "sha256": "8f561a67ff87b401a64ee10dc31e199b81600b19ee134d7a6fececc449cb6759"
    },
    "transferManifest": {
      "size": 2159,
      "sha256": "61597449127245d94bb97f06e56a53de39b70afb03bbe94360d20f5ffd4c3797"
    },
    "coreCandidate": {
      "size": 2387222,
      "sha256": "407638e0ca0db0b3ed47a524fc882a91a82f046cfe3e6d432b20cecf2f5c3395"
    },
    "runtimeCandidate": {
      "size": 162892144,
      "sha256": "70a7acbb8af75f8c138e2e71c5eeede5988483d0e862c47b54572b1c66404ec3"
    },
    "coreAudit": {
      "size": 3099,
      "sha256": "7fc88270fc83dcd8c7e0f2eef04e1674510d4a973aaf4de5fbb375c40c18c204"
    },
    "runtimeAudit": {
      "size": 944,
      "sha256": "0729c2d8a045742a66c4d5e0b92f6b63fe5eeb293f44d505eae49e39689c9f1e"
    },
    "sourceManifest": {
      "size": 18289,
      "sha256": "e3fc16bf4200745bc45ca795069f02117be8d50f9801226251dc87f317eeb6b2"
    },
    "candidateManifest": {
      "size": 18640,
      "sha256": "e2b65e197d7874d507d03d49d18b8a43f10974c70e88b63249b950e79b0cb263"
    },
    "sbom": {
      "size": 17472,
      "sha256": "eaa02374b3744ec3177fcfba43be5f947fa81ce2b59bf112b691323cbf835619"
    },
    "candidateAttestation": {
      "size": 653,
      "sha256": "89ffe9fa45fb8781ba448bb8e43726bb7a396b6e44ea6b4b1c79830246986471"
    }
  },
  "candidatePackages": {
    "core": {
      "id": "JYPPX.ROCm.HIP.CSharp.API",
      "version": "0.9.1",
      "size": 2387222,
      "sha256": "407638e0ca0db0b3ed47a524fc882a91a82f046cfe3e6d432b20cecf2f5c3395",
      "repositoryCommit": "c5e1b28c916a5534d84abed2257a0b513509cbae"
    },
    "runtime": {
      "id": "JYPPX.ROCm.HIP.CSharp.API.Runtime.linux-x64",
      "version": "7.2.1",
      "size": 162892144,
      "sha256": "70a7acbb8af75f8c138e2e71c5eeede5988483d0e862c47b54572b1c66404ec3",
      "repositoryCommit": "c5e1b28c916a5534d84abed2257a0b513509cbae"
    }
  },
  "payload": {
    "coreManagedLicenseAndLogo": {
      "sha256": "7f54d4680fd4db4b48a1f2927f710127091f1c54f5d843ceccbe3d22468e0198",
      "paths": 32
    },
    "runtimeNative": {
      "sha256": "e6ba2a789edb9bc4a6c1655d0d76733471443156ff7d2628e8e45f5d3f00a478",
      "paths": 14
    },
    "runtimeLicenses": {
      "sha256": "0fe536a1ecda77e19b0a5e03641f438253371762d19a0facc8fe8c82c380055e",
      "paths": 7
    },
    "runtimeSbom": {
      "sha256": "b192dfbd36e86cdf0e2d956c88dd9f53376b4f9145aba97de4b42836254ef007",
      "paths": 1
    },
    "runtimeProtectedPayload": {
      "sha256": "abde2e1aef8ee5a632292ff64473e069aa57610a61e065d4142270bf607732b1",
      "paths": 23
    },
    "stagingDigestSha256": "6fd123b1f65062f87d34452793bc82ed889493ccaa11836a58953260587a6c7b"
  },
  "allowedMetadataPaths": {
    "core": [
      "_rels/.rels",
      "[Content_Types].xml",
      "JYPPX.ROCm.HIP.CSharp.API.nuspec",
      "package/services/metadata/core-properties/*.psmdcp",
      "README.md"
    ],
    "runtime": [
      "_rels/.rels",
      "[Content_Types].xml",
      "JYPPX.ROCm.HIP.CSharp.API.Runtime.linux-x64.nuspec",
      "package/services/metadata/core-properties/*.psmdcp",
      "README.md",
      "runtime-manifest.json",
      "promotion-receipt.json"
    ]
  },
  "validationScope": {
    "environment": {
      "os": "Ubuntu 24.04.4",
      "architecture": "x86_64",
      "gpuArchitecture": "gfx1100",
      "isolation": "official-host + PRoot package-only"
    },
    "symbols": {
      "managedRuntime": "91/91",
      "managedHiprtc": "9/9",
      "completeRuntime": "458/459",
      "completeRuntimeAllowedMissing": [
        "hipExternalMemoryGetMappedMipmappedArray"
      ],
      "completeHiprtc": "18/18"
    },
    "abiSchema": 7,
    "managedExpansion": {
      "comparisons": 1127,
      "stages": [
        "m8.2-pitched-memory",
        "m8.3-memory-pool",
        "m8.4-explicit-graph",
        "m8.5-kernel-occupancy",
        "m8.6-module-globals"
      ],
      "skippedStages": [],
      "performanceClaim": false
    },
    "reliability": {
      "status": "passed",
      "rounds": 10,
      "streams": 4,
      "vectorLength": 4194304,
      "maximumInFlightDeviceBytes": 201326592,
      "cpuGpuCompared": true,
      "performanceClaim": false
    },
    "negatives": [
      "missingHsa",
      "coreOnly",
      "tamperedPackage",
      "mixedRuntimeHiprtc"
    ]
  },
  "boundaries": {
    "p2p": "skipped(device-count<2)",
    "windows": "disabled/unverified/static-only",
    "performanceClaim": false,
    "publishable": false,
    "releaseAuthorized": false
  }
}
